{
  "build_id": "build_synthetic",
  "build_identity_digest": "sha256:53effba69a9d01818c4bf41763e97833cc3dc46ab45c9fd7a1e027b8e1707c91",
  "build_variant": "preview",
  "bundle_identifier": "dev.tacua.synthetic",
  "created_at": "2026-07-21T09:55:00Z",
  "distribution": "testflight",
  "expo": {
    "runtime_version": "1.0.0",
    "sdk_version": "56.0.0",
    "update_channel": "preview",
    "update_id": "update_synthetic"
  },
  "message_type": "build_identity",
  "native_build": "42",
  "native_version": "1.0.0",
  "platform": "ios",
  "protocol_version": "tacua.sdk-backend@1.0.0",
  "react_native_version": "0.81.5",
  "source": {
    "git_revision": "aaaaaaaaaaaaaaaaaaaaaaaaaaaaaaaaaaaaaaaa",
    "working_tree_dirty": false
  },
  "transport_configuration_digest": "sha256:c47997c9450351e52632f034548c1909305a1ea274f7e971a2614d866bb0771a"
}
